<?xml version="1.0" encoding="UTF-8"?>
<level xs:noNamespaceSchemaLocation="level.xsd"
	xmlns:xs="http://www.w3.org/2001/XMLSchema-instance">

	<hero>
		<life>200</life>
		<position x="150" y="20" />
		<arme cartouches="-1" type="Echarpe" />
	</hero>

	<blocs>
		<!--contours -->
		<bloc>
			<position x="0" y="720" />
			<dimensions width="1080" height="10" />
		</bloc>
		<bloc>
			<position x="1080" y="0" />
			<dimensions width="10" height="720" />
		</bloc>
		<bloc>
			<position x="-11" y="0" />
			<dimensions width="10" height="720" />
		</bloc>
		<!--sol -->
		<bloc id="2">
			<position x="0" y="0" />
			<dimensions width="1080" height="10" />
		</bloc>

		<!--plafond -->
		<bloc>
			<position x="0" y="660" />
			<dimensions width="1080" height="30" />
		</bloc>
		<bloc hurting="true">
			<position x="0" y="610" />
			<dimensions width="1080" height="49" />
		</bloc>

		<!-- plateforme F -->
		<bloc>
			<position x="0" y="10" />
			<dimensions width="35" height="20" />
		</bloc>
		<bloc>
			<position x="0" y="40" />
			<dimensions width="35" height="20" />
		</bloc>
		<bloc>
			<position x="0" y="70" />
			<dimensions width="75" height="20" />
		</bloc>
		<bloc>
			<position x="0" y="100" />
			<dimensions width="35" height="20" />
		</bloc>
		<bloc>
			<position x="0" y="130" />
			<dimensions width="115" height="20" />
		</bloc>
		<!-- plateforme E -->
		<bloc>
			<position x="241" y="130" />
			<dimensions width="115" height="20" />
		</bloc>
		<bloc>
			<position x="241" y="160" />
			<dimensions width="35" height="20" />
		</bloc>
		<bloc>
			<position x="241" y="190" />
			<dimensions width="75" height="20" />
		</bloc>
		<bloc>
			<position x="241" y="220" />
			<dimensions width="35" height="20" />
		</bloc>
		<bloc id="3">
			<position x="241" y="250" />
			<dimensions width="115" height="20" />
		</bloc>
		<!-- plateforme L -->
		<bloc>
			<position x="482" y="130" />
			<dimensions width="115" height="20" />
		</bloc>
		<bloc>
			<position x="482" y="160" />
			<dimensions width="35" height="20" />
		</bloc>
		<bloc>
			<position x="482" y="190" />
			<dimensions width="35" height="20" />
		</bloc>
		<bloc>
			<position x="482" y="220" />
			<dimensions width="35" height="20" />
		</bloc>
		<bloc>
			<position x="482" y="250" />
			<dimensions width="35" height="20" />
		</bloc>
		<!-- plateforme C -->
			<bloc>
			<position x="723" y="130" />
			<dimensions width="115" height="20" />
		</bloc>
		<bloc>
			<position x="723" y="160" />
			<dimensions width="35" height="20" />
		</bloc>
		<bloc>
			<position x="723" y="190" />
			<dimensions width="35" height="20" />
		</bloc>
		<bloc>
			<position x="723" y="220" />
			<dimensions width="35" height="20" />
		</bloc>
		<bloc>
			<position x="723" y="250" />
			<dimensions width="115" height="20" />
		</bloc>
		<!-- plateforme O -->
		<bloc>
			<position x="960" y="130" />
			<dimensions width="115" height="20" />
		</bloc>
		<bloc>
			<position x="960" y="100" />
			<dimensions width="35" height="20" />
		</bloc>
		<bloc>
			<position x="1040" y="100" />
			<dimensions width="35" height="20" />
		</bloc>
		<bloc>
			<position x="960" y="70" />
			<dimensions width="35" height="20" />
		</bloc>
		<bloc>
			<position x="1040" y="70" />
			<dimensions width="35" height="20" />
		</bloc>
		<bloc>
			<position x="960" y="40" />
			<dimensions width="35" height="20" />
		</bloc>
		<bloc>
			<position x="1040" y="40" />
			<dimensions width="35" height="20" />
		</bloc>
		<bloc>
			<position x="960" y="10" />
			<dimensions width="115" height="20" />
		</bloc>
		
		

		<bloc id="1">
			<position x="0" y="130" />
			<dimensions width="115" height="20" />
		</bloc>
		<bloc>
			<position x="0" y="130" />
			<dimensions width="115" height="20" />
		</bloc>
	</blocs>

	<items>
		<item content="arme" type="Transistor" cartouches="20">
			<position x="540" y="360" />
			<dimensions width="20" height="20" />
		</item>
	</items>

	<bots>

		<bot>
			<type>bino</type>
			<position x="250" y="220" />
			<bloc_id>1</bloc_id>
		</bot>
		
		<bot>
			<type>bino</type>
			<position x="250" y="220" />
			<bloc_id>2</bloc_id>
		</bot>
		
		<bot>
			<type>bino</type>
			<position x="250" y="220" />
			<bloc_id>3</bloc_id>
		</bot>
		
		<bot>
			<type>soso</type>
			<position x="200" y="50" />
		</bot>
		<bot>
			<type>dudu</type>
			<position x="960" y="250" />
		</bot>
	</bots>
</level>