<?xml version="1.0" encoding="UTF-8"?>
<level xs:noNamespaceSchemaLocation="level.xsd"
	xmlns:xs="http://www.w3.org/2001/XMLSchema-instance">
	
	<music src="resources/audio/musique_lvl2.wav"/>
	
	<hero>
		<life>1000</life>
		<position x="15" y="20" />
		<arme cartouches="300" type="Resistance" />
	</hero>

	<blocs>
		<!--contours -->
		<bloc>
			<position x="0" y="720" />
			<dimensions width="1080" height="10" />
		</bloc>
		<bloc>
			<position x="1080" y="0" />
			<dimensions width="10" height="720" />
		</bloc>
		<bloc>
			<position x="-11" y="0" />
			<dimensions width="10" height="720" />
		</bloc>
		<!--sol -->
		<bloc>
			<position x="0" y="0" />
			<dimensions width="80" height="10" />
		</bloc>
		<bloc hurting="true">
			<position x="80" y="0" />
			<dimensions width="900" height="10" />
		</bloc>
		<bloc>
			<position x="980" y="0" />
			<dimensions width="100" height="10" />
		</bloc>
		<!--plafond -->
		<bloc>
			<position x="0" y="660" />
			<dimensions width="1080" height="30" />
		</bloc>
		<bloc hurting="true">
			<position x="0" y="610" />
			<dimensions width="670" height="49" />
		</bloc>
		<bloc hurting="true">
			<position x="730" y="610" />
			<dimensions width="350" height="49" />
		</bloc>
		<!-- plateforme:A -->
		<bloc>
			<position x="100" y="42" />
			<dimensions width="24" height="14" />
		</bloc>
		<bloc>
			<position x="148" y="42" />
			<dimensions width="24" height="14" />
		</bloc>
		<bloc>
			<position x="100" y="64" />
			<dimensions width="24" height="14" />
		</bloc>
		<bloc>
			<position x="148" y="64" />
			<dimensions width="24" height="14" />
		</bloc>
		<bloc>
			<position x="100" y="86" />
			<dimensions width="72" height="14" />
		</bloc>
		<bloc>
			<position x="100" y="108" />
			<dimensions width="24" height="14" />
		</bloc>
		<bloc>
			<position x="148" y="108" />
			<dimensions width="24" height="14" />
		</bloc>
		<bloc>
			<position x="100" y="130" />
			<dimensions width="72" height="14" />
		</bloc>
		<!-- plateforme:D -->
		<bloc>
			<position x="222" y="130" />
			<dimensions width="48" height="14" />
		</bloc>
		<bloc>
			<position x="222" y="152" />
			<dimensions width="24" height="14" />
		</bloc>
		<bloc>
			<position x="270" y="152" />
			<dimensions width="24" height="14" />
		</bloc>
		<bloc>
			<position x="222" y="174" />
			<dimensions width="24" height="14" />
		</bloc>
		<bloc>
			<position x="270" y="174" />
			<dimensions width="24" height="14" />
		</bloc>
		<bloc>
			<position x="222" y="196" />
			<dimensions width="24" height="14" />
		</bloc>
		<bloc>
			<position x="270" y="196" />
			<dimensions width="24" height="14" />
		</bloc>
		<bloc>
			<position x="222" y="218" />
			<dimensions width="48" height="14" />
		</bloc>
		<!-- plateforme:V -->
		<bloc>
			<position x="368" y="218" />
			<dimensions width="24" height="14" />
		</bloc>
		<bloc>
			<position x="351" y="240" />
			<dimensions width="24" height="14" />
		</bloc>
		<bloc>
			<position x="385" y="240" />
			<dimensions width="24" height="14" />
		</bloc>
		<bloc>
			<position x="344" y="262" />
			<dimensions width="24" height="14" />
		</bloc>
		<bloc>
			<position x="392" y="262" />
			<dimensions width="24" height="14" />
		</bloc>
		<bloc>
			<position x="344" y="284" />
			<dimensions width="24" height="14" />
		</bloc>
		<bloc>
			<position x="392" y="284" />
			<dimensions width="24" height="14" />
		</bloc>
		<bloc>
			<position x="344" y="306" />
			<dimensions width="24" height="14" />
		</bloc>
		<bloc>
			<position x="392" y="306" />
			<dimensions width="24" height="14" />
		</bloc>
		<!-- plateforme:I -->
		<bloc>
			<position x="466" y="306" />
			<dimensions width="72" height="14" />
		</bloc>
		<bloc>
			<position x="490" y="328" />
			<dimensions width="24" height="14" />
		</bloc>
		<bloc>
			<position x="490" y="350" />
			<dimensions width="24" height="14" />
		</bloc>
		<bloc>
			<position x="490" y="372" />
			<dimensions width="24" height="14" />
		</bloc>
		<bloc>
			<position x="466" y="394" />
			<dimensions width="72" height="14" />
		</bloc>
		<!-- plateforme:S -->
		<bloc>
			<position x="588" y="306" />
			<dimensions width="72" height="14" />
		</bloc>
		<bloc>
			<position x="588" y="284" />
			<dimensions width="24" height="14" />
		</bloc>
		<bloc>
			<position x="588" y="262" />
			<dimensions width="72" height="14" />
		</bloc>
		<bloc>
			<position x="636" y="240" />
			<dimensions width="24" height="14" />
		</bloc>
		<bloc>
			<position x="588" y="218" />
			<dimensions width="72" height="14" />
		</bloc>
		<!-- plateforme:E -->
		<bloc>
			<position x="710" y="218" />
			<dimensions width="72" height="14" />
		</bloc>
		<bloc>
			<position x="710" y="196" />
			<dimensions width="24" height="14" />
		</bloc>
		<bloc>
			<position x="710" y="174" />
			<dimensions width="48" height="14" />
		</bloc>
		<bloc>
			<position x="710" y="152" />
			<dimensions width="24" height="14" />
		</bloc>
		<bloc>
			<position x="710" y="130" />
			<dimensions width="72" height="14" />
		</bloc>
		<!-- plateforme:N -->
		<bloc>
			<position x="832" y="130" />
			<dimensions width="24" height="14" />
		</bloc>
		<bloc>
			<position x="904" y="130" />
			<dimensions width="24" height="14" />
		</bloc>
		<bloc>
			<position x="832" y="108" />
			<dimensions width="24" height="14" />
		</bloc>
		<bloc>
			<position x="904" y="108" />
			<dimensions width="24" height="14" />
		</bloc>
		<bloc>
			<position x="832" y="86" />
			<dimensions width="24" height="14" />
		</bloc>
		<bloc>
			<position x="904" y="86" />
			<dimensions width="24" height="14" />
		</bloc>
		<bloc>
			<position x="832" y="64" />
			<dimensions width="24" height="14" />
		</bloc>
		<bloc>
			<position x="904" y="64" />
			<dimensions width="24" height="14" />
		</bloc>
		<bloc>
			<position x="832" y="42" />
			<dimensions width="24" height="14" />
		</bloc>
		<bloc>
			<position x="904" y="42" />
			<dimensions width="24" height="14" />
		</bloc>
		<bloc>
			<position x="861" y="98" />
			<dimensions width="24" height="14" />
		</bloc>
		<bloc>
			<position x="875" y="74" />
			<dimensions width="24" height="14" />
		</bloc>


		<bloc id="1">
			<position x="466" y="394" />
			<dimensions width="72" height="14" />
		</bloc>

		<bloc hurting="true">
			<position x="300" y="100" />
			<dimensions width="40" height="30" />
		</bloc>
	</blocs>

	<items>
		<item>
			<position x="1060" y="11" />
			<dimensions width="20" height="60" />
		</item>
	</items>

	<bots>
		<bot>
			<type>bino</type>
			<position x="170" y="125" />
			<bloc_id>1</bloc_id>
		</bot>

		<bot>
			<type>soso</type>
			<position x="150" y="220" />
		</bot>

	</bots>
</level>