<?xml version="1.0" encoding="UTF-8"?>
<level xs:noNamespaceSchemaLocation="level.xsd"
	xmlns:xs="http://www.w3.org/2001/XMLSchema-instance">
	<hero>
		<life>100</life>
		<position x="15" y="20" />
		<arme cartouches="300" type="Resistance" />
	</hero>
	<blocs>
		<!--contours -->
		<bloc>
			<position x="0" y="720" />
			<dimensions width="1080" height="10" />
		</bloc>
		<bloc>
			<position x="1080" y="0" />
			<dimensions width="10" height="720" />
		</bloc>
		<bloc>
			<position x="-11" y="0" />
			<dimensions width="10" height="720" />
		</bloc>
		<!--sol -->
		<bloc>
			<position x="0" y="0" />
			<dimensions width="80" height="10" />
		</bloc>
		<bloc hurting="true">
			<position x="79" y="0" />
			<dimensions width="20" height="10" />
		</bloc>
		<bloc hurting="true">
			<position x="136" y="0" />
			<dimensions width="845" height="10" />
		</bloc>
		<bloc>
			<position x="980" y="0" />
			<dimensions width="100" height="10" />
		</bloc>
		<!--plafond -->
		<bloc>
			<position x="0" y="660" />
			<dimensions width="1080" height="30" />
		</bloc>
		<bloc hurting="true">
			<position x="0" y="610" />
			<dimensions width="710" height="49" />
		</bloc>
		<bloc hurting="true">
			<position x="770" y="610" />
			<dimensions width="350" height="49" />
		</bloc>
		<!--plateformes:F -->
		<bloc>
			<position x="100" y="1" />
			<dimensions width="35" height="10" />
		</bloc>
		<bloc>
			<position x="100" y="20" />
			<dimensions width="35" height="20" />
		</bloc>
		<bloc>
			<position x="100" y="55" />
			<dimensions width="75" height="20" />
		</bloc>
		<bloc>
			<position x="100" y="90" />
			<dimensions width="35" height="20" />
		</bloc>
		<bloc>
			<position x="100" y="125" />
			<dimensions width="115" height="20" />
		</bloc>
		<!--plateformes:E -->
		<bloc>
			<position x="315" y="120" />
			<dimensions width="115" height="20" />
		</bloc>
		<bloc>
			<position x="315" y="155" />
			<dimensions width="35" height="20" />
		</bloc>
		<bloc>
			<position x="315" y="190" />
			<dimensions width="75" height="20" />
		</bloc>
		<bloc>
			<position x="315" y="225" />
			<dimensions width="35" height="20" />
		</bloc>
		<bloc>
			<position x="315" y="260" />
			<dimensions width="115" height="20" />
		</bloc>
		<bloc hurting="true">
			<position x="275" y="225" />
			<dimensions width="39" height="20" />
		</bloc>
		<bloc hurting="true">
			<position x="275" y="190" />
			<dimensions width="39" height="20" />
		</bloc>
		<!--plateformes:S -->
		<bloc>
			<position x="530" y="225" />
			<dimensions width="115" height="20" />
		</bloc>
		<bloc>
			<position x="610" y="260" />
			<dimensions width="35" height="20" />
		</bloc>
		<bloc>
			<position x="530" y="295" />
			<dimensions width="115" height="20" />
		</bloc>
		<bloc>
			<position x="530" y="330" />
			<dimensions width="35" height="20" />
		</bloc>
		<bloc>
			<position x="530" y="365" />
			<dimensions width="115" height="20" />
		</bloc>
		<!--plateformes:T -->
		<bloc>
			<position x="785" y="330" />
			<dimensions width="35" height="20" />
		</bloc>
		<bloc>
			<position x="785" y="365" />
			<dimensions width="35" height="20" />
		</bloc>
		<bloc>
			<position x="785" y="400" />
			<dimensions width="35" height="20" />
		</bloc>
		<bloc>
			<position x="785" y="435" />
			<dimensions width="35" height="20" />
		</bloc>
		<bloc>
			<position x="745" y="470" />
			<dimensions width="115" height="20" />
		</bloc>
		<!--plateformes:O -->
		<bloc>
			<position x="960" y="400" />
			<dimensions width="115" height="20" />
		</bloc>
		<bloc>
			<position x="960" y="365" />
			<dimensions width="35" height="20" />
		</bloc>
		<bloc>
			<position x="1040" y="365" />
			<dimensions width="35" height="20" />
		</bloc>
		<bloc>
			<position x="960" y="330" />
			<dimensions width="35" height="20" />
		</bloc>
		<bloc>
			<position x="1040" y="330" />
			<dimensions width="35" height="20" />
		</bloc>
		<bloc>
			<position x="960" y="295" />
			<dimensions width="35" height="20" />
		</bloc>
		<bloc>
			<position x="1040" y="295" />
			<dimensions width="35" height="20" />
		</bloc>
		<bloc>
			<position x="960" y="260" />
			<dimensions width="115" height="20" />
		</bloc>
		<bloc hurting="true">
			<position x="960" y="210" />
			<dimensions width="115" height="49" />
		</bloc>



		<bloc>
			<position x="770" y="130" />
			<dimensions width="115" height="20" />
		</bloc>
		<bloc hurting="true">
			<position x="100" y="280" />
			<dimensions width="115" height="49" />
		</bloc>
		<bloc id="1">
			<position x="100" y="330" />
			<dimensions width="115" height="30" />
		</bloc>
	</blocs>

	<items>
		<item content="arme" type="Transistor" cartouches="20">
			<position x="730" y="610" />
			<dimensions width="20" height="20" />
		</item>

		<item>
			<position x="1030" y="10" />
			<dimensions width="15" height="60" />
		</item>
	</items>

	<bots>
		<bot>
			<position x="170" y="125" />
			<type>bino</type>
			<bloc_id>1</bloc_id>
		</bot>
		<bot>
			<position x="150" y="220" />
			<type>soso</type>
		</bot>
	</bots>
</level>